{
  "object_type": "workflow_run",
  "schema_version": "1.0.0",
  "workflow_run_id": "01HZXY8Q5GZ07W83T46R6N0P3M",
  "workflow_id": "01HZXY8Q3ZK6MZTHX6T6C2A9JM",
  "status": "running",
  "trigger": "schedule",
  "started_at": "2025-01-15T12:15:00Z",
  "steps": [
    {
      "step_id": "01HZXY8QD2Q7QK5R6V5Z4E2T9A",
      "name": "ingest-source",
      "status": "success",
      "started_at": "2025-01-15T12:15:00Z",
      "finished_at": "2025-01-15T12:16:00Z",
      "output_refs": ["record:01HZXY6F0T1A4A4K8D9F4T7V2R"]
    },
    {
      "step_id": "01HZXY8QFZZ9PSTQH6J5WQ8G8V",
      "name": "normalize",
      "status": "running",
      "started_at": "2025-01-15T12:16:30Z"
    }
  ],
  "created_at": "2025-01-15T12:15:00Z",
  "updated_at": "2025-01-15T12:16:30Z",
  "metadata": { "pipeline": "nightly" }
}
